{
  "entry_id": "fixture-seen",
  "verifier_prompt_version": "verify-v1",
  "removed": [
    {
      "field": "origin",
      "text": "Fixture clause.",
      "cites": [
        "machal1918:p.243"
      ],
      "reason": "Fixture reason."
    }
  ],
  "downgraded": [
    {
      "field": "appearance",
      "text": "Fixture clause.",
      "to_text": "Fixture narrowed clause.",
      "from_cites": [
        "machal1918:p.243"
      ],
      "to_cites": [
        "machal1918:p.243"
      ],
      "reason": "Fixture reason."
    }
  ],
  "retagged": [
    {
      "field": "scene",
      "text": "Fixture clause.",
      "from_cites": [
        "ralston1872:p.123"
      ],
      "to_cites": [
        "ralston1872:pp.120-125"
      ],
      "reason": "Fixture reason."
    }
  ],
  "flagged": [
    {
      "field": "behavior_habitat",
      "text": "Fixture clause.",
      "reason": "Fixture reason."
    }
  ],
  "grade": "regional",
  "grade_rationale": [
    {
      "text": "Fixture clause.",
      "cites": [
        "machal1918:p.243"
      ]
    }
  ]
}
